123,1332016101,วิทยาลัยเทคนิคสุรินทร์,สุรินทร์,ภาคตะวันออกเฉียงเหนือ,วิทยาลัยเทคนิค,346,,,หลักเมือง,ในเมือง,เมืองสุรินทร์,สุรินทร์,32000,044-511190 ต่อ 107,14.8780821,103.5009326,http://www.surintech.ac.th
124,1332016201,วิทยาลัยอาชีวศึกษาสุรินทร์,สุรินทร์,ภาคตะวันออกเฉียงเหนือ,วิทยาลัยอาชีวศึกษา,426,,,เทศบาล1,ในเมือง,เมืองสุรินทร์,สุรินทร์,32000,044-511191,14.8803482,103.5032083,http://www.srvc.ac.th
125,1332016501,วิทยาลัยสารพัดช่างสุรินทร์,สุรินทร์,ภาคตะวันออกเฉียงเหนือ,วิทยาลัยสารพัดช่าง,778,20,0,,นอกเมือง,เมืองสุรินทร์,สุรินทร์,32000,44514414,14.86206019,103.48338,http://www.srpoly.ac.th
126,1332036401,วิทยาลัยการอาชีพท่าตูม,สุรินทร์,ภาคตะวันออกเฉียงเหนือ,วิทยาลัยการอาชีพ,405,7,,ปัทมานนท์,ท่าตูม,ท่าตูม,สุรินทร์,32120,44591769,15.298953,103.666306,http://www.thatum.ac.th
127,1332056401,วิทยาลัยการอาชีพปราสาท,สุรินทร์,ภาคตะวันออกเฉียงเหนือ,วิทยาลัยการอาชีพ,221,5,,โชคชัย-เดชอุดม,ปรือ,ปราสาท,สุรินทร์,32140,44551209,14.652683,103.358002,http://www.prasat.ac.th
128,1332076601,วิทยาลัยเทคนิครัตนบุรี,สุรินทร์,ภาคตะวันออกเฉียงเหนือ,วิทยาลัยเทคนิค,149,15,,รัตนบุรี-ศีขรภูมิ,รัตนบุรี,รัตนบุรี,สุรินทร์,32130,044-598976,15.306648,103.847239,http://www.rbtech.ac.th
129,1332096401,วิทยาลัยการอาชีพศีขรภูมิ,สุรินทร์,ภาคตะวันออกเฉียงเหนือ,วิทยาลัยการอาชีพ,20,1,,สุรินทร์-ศรีสะเกษ,ระแงง,ศีขรภูมิ,สุรินทร์,32110,44560120,14.9447723,103.8086021,http://www.spicc.ac.th
130,1332106401,วิทยาลัยการอาชีพสังขะ,สุรินทร์,ภาคตะวันออกเฉียงเหนือ,วิทยาลัยการอาชีพ,49,7,,โชคชัย-เดชอุดม,บ้านชบ,สังขะ,สุรินทร์,32150,44571078,14.6240415,103.822711,http://www.sangkhaicec.ac.th
131,1333016101,วิทยาลัยเทคนิคศรีสะเกษ,ศรีสะเกษ,ภาคตะวันออกเฉียงเหนือ,วิทยาลัยเทคนิค,319,8,,,หนองครก,เมืองศรีสะเกษ,ศรีสะเกษ,33000,45631369,15.108907,104.319742,http://www.newweb.sisat.ac.th
132,1333016301,วิทยาลัยเกษตรและเทคโนโลยีศรีสะเกษ,ศรีสะเกษ,ภาคตะวันออกเฉียงเหนือ,วิทยาลัยเกษตรและเทคโนโลยี,91,8,,กสิกรรม,หนองครก,เมืองศรีสะเกษ,ศรีสะเกษ,33000,45612934,15.106977,104.314111,http://www.sskcat.ac.th/
133,1333016401,วิทยาลัยการอาชีพศรีสะเกษ,ศรีสะเกษ,ภาคตะวันออกเฉียงเหนือ,วิทยาลัยการอาชีพ,358,8,,กสิกรรม,หนองครก,เมืองศรีสะเกษ,ศรีสะเกษ,33000,45611991,15.1069039,104.3154776,http://www.sicc.ac.th
134,1333016501,วิทยาลัยสารพัดช่างศรีสะเกษ,ศรีสะเกษ,ภาคตะวันออกเฉียงเหนือ,วิทยาลัยสารพัดช่าง,65,,,เทพา,เมืองเหนือ,เมืองศรีสะเกษ,ศรีสะเกษ,33000,45611899,15.1206219,104.3289445,http://www.sipotec.ac.th
135,1333036601,วิทยาลัยเทคนิคกันทรารมย์,ศรีสะเกษ,ภาคตะวันออกเฉียงเหนือ,วิทยาลัยเทคนิค,70,6,ไม่มี,ไม่มี,ดูน,กันทรารมย์,ศรีสะเกษ,33130,45651641,15.103834,104.5859515,http://www.krtc.ac.th
136,1333046401,วิทยาลัยเทคนิคกันทรลักษ์,ศรีสะเกษ,ภาคตะวันออกเฉียงเหนือ,วิทยาลัยเทคนิค,82,1,,กันทรลักษ์-กันทรารมย์,จานใหญ่,กันทรลักษ์,ศรีสะเกษ,33110,045-811053,14.754043,104.65807,http://www.ktltc.ac.th
137,1333056401,วิทยาลัยการอาชีพขุขันธ์,ศรีสะเกษ,ภาคตะวันออกเฉียงเหนือ,วิทยาลัยการอาชีพ,119,6,กลาง,,หนองฉลอง,ขุขันธ์,ศรีสะเกษ,33140,0 4582 6455,14.66131,104.22262,http://www.khice.ac.th
138,1333086401,วิทยาลัยการอาชีพขุนหาญ,ศรีสะเกษ,ภาคตะวันออกเฉียงเหนือ,วิทยาลัยการอาชีพ,153,8,,ขุนหาญ-สำโรงเกียรติ,สิ,ขุนหาญ,ศรีสะเกษ,33150,0-45826363,14.5961488,104.4359913,http://www.khicec.ac.th
139,1333096601,วิทยาลัยเทคนิคราษีไศล,ศรีสะเกษ,ภาคตะวันออกเฉียงเหนือ,วิทยาลัยเทคนิค,98,3,,,ดู่,ราษีไศล,ศรีสะเกษ,33160,933277908,15.378423,104.157624,http://www.rstech.ac.th/
140,1334016101,วิทยาลัยเทคนิคอุบลราชธานี,อุบลราชธานี,ภาคตะวันออกเฉียงเหนือ,วิทยาลัยเทคนิค,5,,,แจ้งสนิท,ในเมือง,เมืองอุบลราชธานี,อุบลราชธานี,34000,045-240577,15.2416967,104.8454583,http://www.utc.ac.th
141,1334016201,วิทยาลัยอาชีวศึกษาอุบลราชธานี,อุบลราชธานี,ภาคตะวันออกเฉียงเหนือ,วิทยาลัยอาชีวศึกษา,410,,,พรหมราช,ในเมือง,เมืองอุบลราชธานี,อุบลราชธานี,34000,656516577,15.22560159,104.8561898,http://www.uvc.ac.th
142,1334016301,วิทยาลัยเกษตรและเทคโนโลยีอุบลราชธานี,อุบลราชธานี,ภาคตะวันออกเฉียงเหนือ,วิทยาลัยเกษตรและเทคโนโลยี,117,7,,แจ้งสนิท,หนองขอน,เมืองอุบลราชธานี,อุบลราชธานี,34000,45252806,15.311806,104.713167,http://www.uboncat.ac.th
143,1334016501,วิทยาลัยเทคนิคนครอุบลราชธานี,อุบลราชธานี,ภาคตะวันออกเฉียงเหนือ,วิทยาลัยเทคนิค,35,0,,จงกลนิธารณ์,ในเมือง,เมืองอุบลราชธานี,อุบลราชธานี,34000,45244754,15.2303152,104.8508549,http://www.sarapadchangubon.ac.th
144,1334056401,วิทยาลัยเทคนิคเขมราฐ,อุบลราชธานี,ภาคตะวันออกเฉียงเหนือ,วิทยาลัยเทคนิค,128 หมู่ 5,5,,บ้านคึมพอก-บ้านนาเจริญ,หนองนกทา,เขมราฐ,อุบลราชธานี,34170,"045210500 ,081976772",15.990705,105.099678,http://www.km-tech.ac.th
145,1334076101,วิทยาลัยเทคนิคเดชอุดม,อุบลราชธานี,ภาคตะวันออกเฉียงเหนือ,วิทยาลัยเทคนิค,377,30,,โชคชัย-เดชอุดม,เมืองเดช,เดชอุดม,อุบลราชธานี,34160,45249050,14.90453523,105.0362753,http://www.dtec.ac.th
146,1334116401,วิทยาลัยเทคนิคตระการพืชผล,อุบลราชธานี,ภาคตะวันออกเฉียงเหนือ,วิทยาลัยเทคนิค,11,10,,อุบล-ตระการ กม.40,เซเป็ด,ตระการพืชผล,อุบลราชธานี,34130,045-427532,15.573435,104.999771,http://www.tkc.ac.th
147,1334116601,วิทยาลัยเทคนิคพิบูลมังสาหาร,อุบลราชธานี,ภาคตะวันออกเฉียงเหนือ,วิทยาลัยเทคนิค,188,4,,,กุดชมภู,พิบูลมังสาหาร,อุบลราชธานี,34110,045-442055,15.235222,105.24794,http://www.pmtc.ac.th
148,1334156401,วิทยาลัยการอาชีพวารินชำราบ,อุบลราชธานี,ภาคตะวันออกเฉียงเหนือ,วิทยาลัยการอาชีพ,187,7,,,แสนสุข,วารินชำราบ,อุบลราชธานี,34190,045-854086,15.1561155,104.8475809,http://www.warinice.ac.th
149,1335016101,วิทยาลัยเทคนิคยโสธร,ยโสธร,ภาคตะวันออกเฉียงเหนือ,วิทยาลัยเทคนิค,96,1,,ยโสธร-สุวรรณภูมิ,สำราญ,เมืองยโสธร,ยโสธร,35000,045-756701,15.8113965,104.126123,http://www.yt.ac.th
150,1335066301,วิทยาลัยเกษตรและเทคโนโลยียโสธร,ยโสธร,ภาคตะวันออกเฉียงเหนือ,วิทยาลัยเกษตรและเทคโนโลยี,173,2,,คำเขื่อนแก้ว-มหาชนะชัย,บากเรือ,มหาชนะชัย,ยโสธร,35130,45756616,15.546846,104.283958,http://www.kasetyaso.ac.th
151,1335086401,วิทยาลัยเทคนิคเลิงนกทา,ยโสธร,ภาคตะวันออกเฉียงเหนือ,วิทยาลัยเทคนิค,285,1,,สวาท-หนองแสง,สวาท,เลิงนกทา,ยโสธร,35120,0 4578 1804,104.515212,16.187887,http://www.licec.ac.th
152,1336016101,วิทยาลัยเทคนิคชัยภูมิ,ชัยภูมิ,ภาคตะวันออกเฉียงเหนือ,วิทยาลัยเทคนิค,260,4,,องค์การบริหารส่วนจังหวัดสาย2,ในเมือง,เมืองชัยภูมิ,ชัยภูมิ,36000,044812075-6,15.812322,102.016125,http://www.ccollege.ac.th
153,1336016301,วิทยาลัยเกษตรและเทคโนโลยีชัยภูมิ,ชัยภูมิ,ภาคตะวันออกเฉียงเหนือ,วิทยาลัยเกษตรและเทคโนโลยี,115,8,,นิเวศรัตน์,ในเมือง,เมืองชัยภูมิ,ชัยภูมิ,36000,44811160,102.041874,15.82281,http://www.ccat.ac.th
154,1336016501,วิทยาลัยอาชีวศึกษาเมืองชัยภูมิ,ชัยภูมิ,ภาคตะวันออกเฉียงเหนือ,วิทยาลัยอาชีวศึกษา,380ก,,,โนนม่วง,ในเมือง,เมืองชัยภูมิ,ชัยภูมิ,36000,44812083,15.8076801,102.0281906,http://main.cpmpoly.ac.th
155,1336076401,วิทยาลัยการอาชีพบำเหน็จณรงค์,ชัยภูมิ,ภาคตะวันออกเฉียงเหนือ,วิทยาลัยการอาชีพ,1,15,,บำเหน็จณรงค์-ซับใหญ่,บ้านชวน,บำเหน็จณรงค์,ชัยภูมิ,36160,080-0066021,15.5210951,101.6725529,http://www.bamnet.ac.th
156,1336126401,วิทยาลัยการอาชีพแก้งคร้อ,ชัยภูมิ,ภาคตะวันออกเฉียงเหนือ,วิทยาลัยการอาชีพ,189,3,,ชัยภูมิ-ชุมแพ,ช่องสามหมอ,แก้งคร้อ,ชัยภูมิ,36150,0-44882239,16.0857707,102.2691045,http://www.kec.ac.th
157,1337016101,วิทยาลัยเทคนิคอำนาจเจริญ,อำนาจเจริญ,ภาคตะวันออกเฉียงเหนือ,วิทยาลัยเทคนิค,135,9,,ชยางกูร,นาผือ,เมืองอำนาจเจริญ,อำนาจเจริญ,37000,45989660,15.9478869,104.6283824,http://www.ant.ac.th
158,1337066401,วิทยาลัยเทคนิคหัวตะพาน,อำนาจเจริญ,ภาคตะวันออกเฉียงเหนือ,วิทยาลัยเทคนิค,53,3,,หัวตะพาน-บ้านขมิ้น,หนองแก้ว,หัวตะพาน,อำนาจเจริญ,37240,045-989658,15.692597,104.5595244,http://www.h-tech.ac.th
159,1338036401,วิทยาลัยเทคนิคบึงกาฬ,บึงกาฬ,ภาคตะวันออกเฉียงเหนือ,วิทยาลัยเทคนิค,101,4,,แสนประเสริฐ-นาป่าน,วิศิษฐ์,เมืองบึงกาฬ,บึงกาฬ,38000,42491639,18.3598699,103.6229753,http://www.bk-tech.ac.th
160,1338096401,วิทยาลัยเทคนิคเซกา,บึงกาฬ,ภาคตะวันออกเฉียงเหนือ,วิทยาลัยเทคนิค,99,4,,เซกา-อากาศอำนวย,ซาง,เซกา,บึงกาฬ,38150,042-490-644,17.89414,103.952566,http://www.seka-tech.ac.th
161,1339016101,วิทยาลัยเทคนิคหนองบัวลำภู,หนองบัวลำภู,ภาคตะวันออกเฉียงเหนือ,วิทยาลัยเทคนิค,102,3,,เทศบาล - หนองหว้า,โพธิ์ชัย,เมืองหนองบัวลำภู,หนองบัวลำภู,39000,042-312-753,17.189918,102.406788,http://www.nbtc.ac.th
162,1339046401,วิทยาลัยการอาชีพศรีบุญเรือง,หนองบัวลำภู,ภาคตะวันออกเฉียงเหนือ,วิทยาลัยการอาชีพ,142,10,,,ศรีบุญเรือง,ศรีบุญเรือง,หนองบัวลำภู,39180,042-353732,16.9470285,102.24605,http://www.sbr.ac.th
163,1340016101,วิทยาลัยเทคนิคขอนแก่น,ขอนแก่น,ภาคตะวันออกเฉียงเหนือ,วิทยาลัยเทคนิค,67,4,,ศรีจันทร์,ในเมือง,เมืองขอนแก่น,ขอนแก่น,40000,43221290,16.428388,102.847499,http://www.kktech.ac.th
164,1340016201,วิทยาลัยอาชีวศึกษาขอนแก่น,ขอนแก่น,ภาคตะวันออกเฉียงเหนือ,วิทยาลัยอาชีวศึกษา,1-ม.ค.,,,หลังเมือง,ในเมือง,เมืองขอนแก่น,ขอนแก่น,40000,43236538,16.437473,102.838957,http://www.kvc.ac.th
165,1340016501,วิทยาลัยเทคนิคนครขอนแก่น,ขอนแก่น,ภาคตะวันออกเฉียงเหนือ,วิทยาลัยเทคนิค,316,18,,มิตรภาพ,ท่าพระ,เมืองขอนแก่น,ขอนแก่น,40260,43262085,16.330322,102.799506,http://www.n-tech.ac.th
166,1340046301,วิทยาลัยเทคโนโลยีเกษตรอุตสาหกรรมชั้นสูงขอนแก่น,ขอนแก่น,ภาคตะวันออกเฉียงเหนือ,วิทยาลัยเกษตรและเทคโนโลยี,195,7,,ภูเวียง-กุดฉิม,โนนทัน,หนองเรือ,ขอนแก่น,40210,043 424 570,16.4957971,102.4035581,-
167,1340056401,วิทยาลัยเทคนิคชุมแพ,ขอนแก่น,ภาคตะวันออกเฉียงเหนือ,วิทยาลัยเทคนิค,271,14,,แพงไท,หนองไผ่,ชุมแพ,ขอนแก่น,40130,043-311020,16.5609673,102.0942146,http://www.chumphae.ac.th
168,1340076101,วิทยาลัยเทคนิคน้ำพอง,ขอนแก่น,ภาคตะวันออกเฉียงเหนือ,วิทยาลัยเทคนิค,486,4,,หินกอง-หนองอ้อ,น้ำพอง,น้ำพอง,ขอนแก่น,40310,43441804,16.7401194,102.7958301,http://www.ntckk.ac.th
169,1340096401,วิทยาลัยการอาชีพกระนวน,ขอนแก่น,ภาคตะวันออกเฉียงเหนือ,วิทยาลัยการอาชีพ,6,6,,กระนวน-น้ำพอง,หนองโน,กระนวน,ขอนแก่น,40170,0-43923044,16.69525,103.01865,http://www.kic.ac.th
170,1340106401,วิทยาลัยการอาชีพบ้านไผ่,ขอนแก่น,ภาคตะวันออกเฉียงเหนือ,วิทยาลัยการอาชีพ,113,2,,,หนองน้ำใส,บ้านไผ่,ขอนแก่น,40110,0-43272129,16.034554,102.741489,http://www.bpic.ac.th
171,1340126401,วิทยาลัยการอาชีพพล,ขอนแก่น,ภาคตะวันออกเฉียงเหนือ,วิทยาลัยการอาชีพ,203,3,,มิตรภาพ-โคกสี,โนนข่า,พล,ขอนแก่น,40120,043-416020,15.7624927,102.5998793,http://www.Pholiac.ac.th
172,1340156601,วิทยาลัยการอาชีพหนองสองห้อง,ขอนแก่น,ภาคตะวันออกเฉียงเหนือ,วิทยาลัยการอาชีพ,228,8,,หนองสองห้อง-บ้านกุดหอยกาบ,หนองสองห้อง,หนองสองห้อง,ขอนแก่น,40190,43306660,15.72334,102.764439,http://www.nhtech.ac.th
173,1340176301,วิทยาลัยเกษตรและเทคโนโลยีขอนแก่น,ขอนแก่น,ภาคตะวันออกเฉียงเหนือ,วิทยาลัยเกษตรและเทคโนโลยี,176,7,0,แจ้งสนิท,กุดเค้า,มัญจาคีรี,ขอนแก่น,40160,43009772,16.091591,102.552117,http://www.kkcat.ac.th
174,1340186401,วิทยาลัยการอาชีพขอนแก่น,ขอนแก่น,ภาคตะวันออกเฉียงเหนือ,วิทยาลัยการอาชีพ,172,3,,แจ้งสนิท,ชนบท,ชนบท,ขอนแก่น,40180,043-286218 ต่อ 145,16.0915411,102.608227,http://www.kknic.ac.th/web2019/
175,1341016101,วิทยาลัยเทคนิคอุดรธานี,อุดรธานี,ภาคตะวันออกเฉียงเหนือ,วิทยาลัยเทคนิค,3,,,วัฒนานุวงศ์,หมากแข้ง,เมืองอุดรธานี,อุดรธานี,41000,42221538,17.4160049,102.7887514,http://www.udontech.ac.th
176,1341016102,วิทยาลัยเทคนิคกาญจนาภิเษกอุดรธานี,อุดรธานี,ภาคตะวันออกเฉียงเหนือ,วิทยาลัยเทคนิค,7,1,,อุดร-ขอนแก่น,หนองไผ่,เมืองอุดรธานี,อุดรธานี,41330,0-4229-5547,102.887049,17.259105,http://www.kutcudon.ac.th
177,1341016201,วิทยาลัยอาชีวศึกษาอุดรธานี,อุดรธานี,ภาคตะวันออกเฉียงเหนือ,วิทยาลัยอาชีวศึกษา,8,,,โพศรี,หมากแข้ง,เมืองอุดรธานี,อุดรธานี,41000,42246690,17.4099611,102.7793581,http://www.udvc.ac.th
178,1341016301,วิทยาลัยเกษตรและเทคโนโลยีอุดรธานี,อุดรธานี,ภาคตะวันออกเฉียงเหนือ,วิทยาลัยเกษตรและเทคโนโลยี,230,11,,มิตรภาพ-ดงเจริญ,กุดสระ,เมืองอุดรธานี,อุดรธานี,41000,42266103,17.471716,102.8100609,http://www.udcat.ac.th
179,1341016501,วิทยาลัยสารพัดช่างอุดรธานี,อุดรธานี,ภาคตะวันออกเฉียงเหนือ,วิทยาลัยสารพัดช่าง,137,,,อำเภอ,หมากแข้ง,เมืองอุดรธานี,อุดรธานี,41000,42221170,17.3974227,102.7884625,http://www.uptech.ac.th
180,1341046401,วิทยาลัยการอาชีพกุมภวาปี,อุดรธานี,ภาคตะวันออกเฉียงเหนือ,วิทยาลัยการอาชีพ,301,1,,มิตรภาพ อุดร-ขอนแก่น,ปะโค,กุมภวาปี,อุดรธานี,41370, 042-339744,17.1165834,102.9424702,http://www.kpic.ac.th/
181,1341066401,วิทยาลัยการอาชีพหนองหาน,อุดรธานี,ภาคตะวันออกเฉียงเหนือ,วิทยาลัยการอาชีพ,572,19,,หนองหาน-กุมภาวปี,หนองหาน,หนองหาน,อุดรธานี,41130,042-261289,17.351551,103.105754,http://www.nonghan.ac.th
182,1341176401,วิทยาลัยการอาชีพบ้านผือ,อุดรธานี,ภาคตะวันออกเฉียงเหนือ,วิทยาลัยการอาชีพ,417 หมู่ที่ 1,,,บริบาลภูมิเขตต์,บ้านผือ,บ้านผือ,อุดรธานี,41160,042-282133,17.6760237,102.4719097,http://www.bec.ac.th
183,1341196201,วิทยาลัยการอาชีพอุดรธานี,อุดรธานี,ภาคตะวันออกเฉียงเหนือ,วิทยาลัยการอาชีพ,88,14,,มิตรภาพ(อุดร-หนองคาย),เชียงหวาง,เพ็ญ,อุดรธานี,41150,42219967,17.6645739,102.9435536,http://www.udcbat.ac.th
184,1342016101,วิทยาลัยเทคนิคเลย,เลย,ภาคตะวันออกเฉียงเหนือ,วิทยาลัยเทคนิค,272,,,เจริญรัฐ,กุดป่อง,เมืองเลย,เลย,42000,0-4281-1591,17.473746,101.729489,https://www.loeitech.ac.th
185,1342016201,วิทยาลัยอาชีวศึกษาเลย,เลย,ภาคตะวันออกเฉียงเหนือ,วิทยาลัยอาชีวศึกษา,1-มิ.ย.,,,ชุมสาย,กุดป่อง,เมืองเลย,เลย,42000,42812395,17.4872346,101.7317973,http://www.lvc.ac.th
