254,1355016501,วิทยาลัยสารพัดช่างน่าน,น่าน,ภาคเหนือ,วิทยาลัยสารพัดช่าง,150,,,สุมนเทวราช,ในเวียง,เมืองน่าน,น่าน,55000,054-710367,18.183812,100.779115,http://www.npc.ac.th
255,1355056401,วิทยาลัยเทคนิคปัว,น่าน,ภาคเหนือ,วิทยาลัยเทคนิค,237,1,,น่าน-ทุ่งช้าง,ปัว,ปัว,น่าน,55120,54791326,19.18057507,100.8881104,http://www.puaicec.ac.th
256,1355076401,วิทยาลัยการอาชีพเวียงสา,น่าน,ภาคเหนือ,วิทยาลัยการอาชีพ,138,5,,ยันตรกิจโกศล,นาเหลือง,เวียงสา,น่าน,55110,54718340,18.6792609,100.8245199,http://www.wiangsa.ac.th
257,1356016101,วิทยาลัยเทคนิคพะเยา,พะเยา,ภาคเหนือ,วิทยาลัยเทคนิค,355,11,,สนามกีฬา,บ้านต๋อม,เมืองพะเยา,พะเยา,56000,0-54887199,19.20122979,99.88717431,http://www.phayaotc.ac.th
258,1356016301,วิทยาลัยเกษตรและเทคโนโลยีพะเยา,พะเยา,ภาคเหนือ,วิทยาลัยเกษตรและเทคโนโลยี,1,6,,พะเยา - วังเหนือ,แม่นาเรือ,เมืองพะเยา,พะเยา,56000,0-5407-9835,19.0921762,99.8241777,http://www.pycat.ac.th
259,1356036401,วิทยาลัยเทคนิคเชียงคำ,พะเยา,ภาคเหนือ,วิทยาลัยเทคนิค,141,10,,เชียงคำ-ปง,ฝายกวาง,เชียงคำ,พะเยา,56110,054-883510,19.4632792,100.323735,http://www.cktc.ac.th
260,1356056401,วิทยาลัยเทคนิคดอกคำใต้,พะเยา,ภาคเหนือ,วิทยาลัยเทคนิค,69,10,,,ดงสุวรรณ,ดอกคำใต้,พะเยา,56120,0-54894574,19.243736,100.0494,http://www.dkttc.ac.th
261,1356066601,วิทยาลัยการอาชีพปง,พะเยา,ภาคเหนือ,วิทยาลัยการอาชีพ,135,6,,จุน-ปง,นาปรัง,ปง,พะเยา,56140,54430982,19.1972605,100.2635637,http://www.pongtechno.ac.th
262,1357016101,วิทยาลัยเทคนิคเชียงราย,เชียงราย,ภาคเหนือ,วิทยาลัยเทคนิค,1046,,,สนามบิน,เวียง,เมืองเชียงราย,เชียงราย,57000,53713038,19.9028365,99.8282573,http://www.ctc.ac.th
263,1357016102,วิทยาลัยเทคนิคกาญจนาภิเษกเชียงราย,เชียงราย,ภาคเหนือ,วิทยาลัยเทคนิค,91,9,,เด่นห้า-ดงมะดะ,ป่าอ้อดอนชัย,เมืองเชียงราย,เชียงราย,57000,0-53673912,19.862183,99.767868,http://www.kctc.ac.th
264,1357016201,วิทยาลัยอาชีวศึกษาเชียงราย,เชียงราย,ภาคเหนือ,วิทยาลัยอาชีวศึกษา,670,,,ธนาลัย,เวียง,เมืองเชียงราย,เชียงราย,57000,053-713036,19.908974,99.836214,http://www.cvc.ac.th
265,1357016301,วิทยาลัยเกษตรและเทคโนโลยีเชียงราย,เชียงราย,ภาคเหนือ,วิทยาลัยเกษตรและเทคโนโลยี,51,6,2,บ้านฟาร์มสัมพันธกิจ,ริมกก,เมืองเชียงราย,เชียงราย,57100,052-029695,19.9389969,99.9031287,http://www.crcat.ac.th/2019
266,1357016401,วิทยาลัยการอาชีพเชียงราย,เชียงราย,ภาคเหนือ,วิทยาลัยการอาชีพ,324,13,,เชียงราย-เทิง,ท่าสาย,เมืองเชียงราย,เชียงราย,57000,0-5377-4589,19.8511225,99.8481578,http://www.cric.ac.th
267,1357026401,วิทยาลัยการอาชีพเวียงเชียงรุ้ง,เชียงราย,ภาคเหนือ,วิทยาลัยการอาชีพ,132,3,2,บ้านเด่นสันทราย,ทุ่งก่อ,เวียงเชียงรุ้ง,เชียงราย,57350,53953392,19.97113,100.021935,http://www.wice.ac.th
268,1357046401,วิทยาลัยเทคนิคเทิง,เชียงราย,ภาคเหนือ,วิทยาลัยเทคนิค,191,15,,พิศาล,เวียง,เทิง,เชียงราย,57160,053-795526,19.683115,100.199108,http://www.tice.ac.th
269,1357116101,วิทยาลัยเทคนิคเวียงป่าเป้า,เชียงราย,ภาคเหนือ,วิทยาลัยเทคนิค,200,6,,เชียงใหม่-เชียงราย,ป่างิ้ว,เวียงป่าเป้า,เชียงราย,57170,53952014,19.2761004,99.5107926,http://www.wpptech.ac.th
270,1358016401,วิทยาลัยการอาชีพนวมินทราชินีแม่ฮ่องสอน,แม่ฮ่องสอน,ภาคเหนือ,วิทยาลัยการอาชีพ,126,,,ขุนลุมประพาส,จองคำ,เมืองแม่ฮ่องสอน,แม่ฮ่องสอน,58000,053-611848,19.28643898,97.96186007,http://www.nawamin.ac.th
271,1358046401,วิทยาลัยการอาชีพแม่สะเรียง,แม่ฮ่องสอน,ภาคเหนือ,วิทยาลัยการอาชีพ,111,7,,แม่สะเรียง-แม่สอด,แม่สะเรียง,แม่สะเรียง,แม่ฮ่องสอน,58110,53681576,18.105771,97.93752,http://www.msr.ac.th
272,1360016101,วิทยาลัยเทคนิคนครสวรรค์,นครสวรรค์,ภาคเหนือ,วิทยาลัยเทคนิค,400,9,,สวรรค์วิถี,นครสวรรค์ตก,เมืองนครสวรรค์,นครสวรรค์,60000,56221390,15.6921247,100.1164814,http://www.nkstec.ac.th
273,1360016201,วิทยาลัยอาชีวศึกษานครสวรรค์,นครสวรรค์,ภาคเหนือ,วิทยาลัยอาชีวศึกษา,193,,,มาตุลี,ปากน้ำโพ,เมืองนครสวรรค์,นครสวรรค์,60000,56221360,15.710869,100.12944,http://www.nwvoc.ac.th
274,1360016301,วิทยาลัยเกษตรและเทคโนโลยีนครสวรรค์,นครสวรรค์,ภาคเหนือ,วิทยาลัยเกษตรและเทคโนโลยี,184,9,,นครสวรรค์-พิษณุโลก,บ้านมะเกลือ,เมืองนครสวรรค์,นครสวรรค์,60000,56276216,15.7930896,100.1251938,http://www.nscat.ac.th
275,1360016401,วิทยาลัยการอาชีพนครสวรรค์,นครสวรรค์,ภาคเหนือ,วิทยาลัยการอาชีพ,155/1,1,,,นครสวรรค์ออก,เมืองนครสวรรค์,นครสวรรค์,60000,0-56255347,15.663665,100.130824,http://www.nice.ac.th
276,1360056401,วิทยาลัยการอาชีพบรรพตพิสัย,นครสวรรค์,ภาคเหนือ,วิทยาลัยการอาชีพ,99,2,,นครสวรรค์-บรรพตพิสัย,บางตาหงาย,บรรพตพิสัย,นครสวรรค์,60180,056-009536,15.935668,99.99193,http://www.bice.ac.th
277,1360126601,วิทยาลัยการอาชีพตากฟ้า,นครสวรรค์,ภาคเหนือ,วิทยาลัยการอาชีพ,6-ม.ค.,1,,ตากฟ้า-ท่าตะโก,ตากฟ้า,ตากฟ้า,นครสวรรค์,60190,056-241906,15.351185,100.493127,http://www.tftmc.ac.th
278,1360136101,วิทยาลัยเทคนิคแม่วงก์,นครสวรรค์,ภาคเหนือ,วิทยาลัยเทคนิค,10-ม.ค.,10,,เขาชนกัน-ลานสัก,วังซ่าน,แม่วงก์,นครสวรรค์,60150,864175734,15.820884,99.500058,http://www.mwtech.ac.th
279,1361016101,วิทยาลัยเทคนิคอุทัยธานี,อุทัยธานี,ภาคเหนือ,วิทยาลัยเทคนิค,58,,,วงศาโรจน์,อุทัยใหม่,เมืองอุทัยธานี,อุทัยธานี,61000,946160005,15.367502,100.045268,http://www.uthai.ac.th
280,1361016301,วิทยาลัยเกษตรและเทคโนโลยีอุทัยธานี,อุทัยธานี,ภาคเหนือ,วิทยาลัยเกษตรและเทคโนโลยี,27  หมู่ 5,,,อุทัยธานี-ทัพทัน,หนองแก,เมืองอุทัยธานี,อุทัยธานี,61000,0-56982621,15.43156516,99.98262948,http://www.utac.ac.th
281,1361016501,วิทยาลัยสารพัดช่างอุทัยธานี,อุทัยธานี,ภาคเหนือ,วิทยาลัยสารพัดช่าง,45,3,,อุทัย-หนองฉาง,น้ำซึม,เมืองอุทัยธานี,อุทัยธานี,61000,56970097,15.349444,100.004784,http://www.uthaipoly.ac.th
282,1362016101,วิทยาลัยเทคนิคกำแพงเพชร,กำแพงเพชร,ภาคเหนือ,วิทยาลัยเทคนิค,50,,,ปิ่นดำริห์,ในเมือง,เมืองกำแพงเพชร,กำแพงเพชร,62000,055-711-090,16.4844981,99.5269475,http://www.kpt.ac.th
283,1362016301,วิทยาลัยเกษตรและเทคโนโลยีกำแพงเพชร,กำแพงเพชร,ภาคเหนือ,วิทยาลัยเกษตรและเทคโนโลยี,104,7,,กำแพงเพชร-พิจิตร,นิคมทุ่งโพธิ์ทะเล,เมืองกำแพงเพชร,กำแพงเพชร,62000,055-741660,16.491176,99.7131257,http://www.kpcat.ac.th
284,1362016501,วิทยาลัยสารพัดช่างกำแพงเพชร,กำแพงเพชร,ภาคเหนือ,วิทยาลัยสารพัดช่าง,1-ก.พ.,1,,,หนองปลิง,เมืองกำแพงเพชร,กำแพงเพชร,62000,055-841-823,16.50532228,99.49852841,http://www.kpp.ac.th
285,1362046401,วิทยาลัยการอาชีพขาณุวรลักษบุรี,กำแพงเพชร,ภาคเหนือ,วิทยาลัยการอาชีพ,49,5,,,ป่าพุทรา,ขาณุวรลักษบุรี,กำแพงเพชร,62130,055-779478,16.1074212,99.8968373,http://www.khanu.ac.th
286,1363016301,วิทยาลัยเกษตรและเทคโนโลยีตาก,ตาก,ภาคเหนือ,วิทยาลัยเกษตรและเทคโนโลยี,208,3,,พหลโยธิน,ประดาง,วังเจ้า,ตาก,63180,055-896567-8,16.754849,99.201884,http://www.kasettak.ac.th
287,1363016501,วิทยาลัยเทคนิคตาก,ตาก,ภาคเหนือ,วิทยาลัยเทคนิค,195,3,,เจดีย์ยุทธหัตถี,ป่ามะม่วง,เมืองตาก,ตาก,63000,55514231,16.8838412,99.1117428,http://www.taktc.ac.th
288,1363026401,วิทยาลัยการอาชีพบ้านตาก,ตาก,ภาคเหนือ,วิทยาลัยการอาชีพ,116,4,,พหลโยธิน,ตากออก,บ้านตาก,ตาก,63120,055-591426,17.0397984,99.0853423,http://www.bantak.ac.th
289,1363066401,วิทยาลัยเทคนิคแม่สอด,ตาก,ภาคเหนือ,วิทยาลัยเทคนิค,619,10,,แม่สอด-แม่ปะใต้,แม่ปะ,แม่สอด,ตาก,63110,0-55532644,16.7374793,98.5671237,https://www.maesod.ac.th
290,1364016101,วิทยาลัยเทคนิคสุโขทัย,สุโขทัย,ภาคเหนือ,วิทยาลัยเทคนิค,2-เม.ย.,5,,จรดวิถีถ่อง,บ้านกล้วย,เมืองสุโขทัย,สุโขทัย,64000,55611201,17.0111146,99.7896981,http://www.Sukhothaitc.ac.th
291,1364016201,วิทยาลัยอาชีวศึกษาสุโขทัย,สุโขทัย,ภาคเหนือ,วิทยาลัยอาชีวศึกษา,108,1,,สิงหวัฒน์,ธานี,เมืองสุโขทัย,สุโขทัย,64000,55611789,17.008169,99.827516,http://www.stvc.ac.th
292,1364016501,วิทยาลัยสารพัดช่างสุโขทัย,สุโขทัย,ภาคเหนือ,วิทยาลัยสารพัดช่าง,11,13,,จรดวิถีถ่อง,บ้านกล้วย,เมืองสุโขทัย,สุโขทัย,64000,55613341,17.007709,99.7972727,http://www.sukhothai-pc.ac.th
293,1364056401,วิทยาลัยการอาชีพศรีสัชนาลัย,สุโขทัย,ภาคเหนือ,วิทยาลัยการอาชีพ,362,3,,พัฒนาการ,สารจิตร,ศรีสัชนาลัย,สุโขทัย,64130,0-5567-5123,17.463091,99.732256,http://www.siec.ac.th
294,1364066401,วิทยาลัยการอาชีพศรีสำโรง,สุโขทัย,ภาคเหนือ,วิทยาลัยการอาชีพ,9,11,,ศรีสำโรง-ศรีนคร,สามเรือน,ศรีสำโรง,สุโขทัย,64120,055-683006,17.1898638,99.9106469,http://www.sie.ac.th
295,1364076301,วิทยาลัยเกษตรและเทคโนโลยีสุโขทัย,สุโขทัย,ภาคเหนือ,วิทยาลัยเกษตรและเทคโนโลยี,16,7,,ไม่มี,ย่านยาว,สวรรคโลก,สุโขทัย,64110,55911076,17.284242,99.867112,http://www.stcat.ac.th
296,1365016101,วิทยาลัยเทคนิคพิษณุโลก,พิษณุโลก,ภาคเหนือ,วิทยาลัยเทคนิค,2,,,สนามบิน,ในเมือง,เมืองพิษณุโลก,พิษณุโลก,65000,55302029,16.811884,100.271159,http://www.pltc.ac.th
297,1365016102,วิทยาลัยเทคนิคสองแคว,พิษณุโลก,ภาคเหนือ,วิทยาลัยเทคนิค,149,2,,เลี่ยงเมืองพิษณุโลก,ท่าโพธิ์,เมืองพิษณุโลก,พิษณุโลก,65000,095-640-0956,16.7611153,100.2406433,http://www.sktcpl.ac.th
298,1365016201,วิทยาลัยอาชีวศึกษาพิษณุโลก,พิษณุโลก,ภาคเหนือ,วิทยาลัยอาชีวศึกษา,60,1,,วังจันทน์,ในเมือง,เมืองพิษณุโลก,พิษณุโลก,65000,55258570,16.8213387,100.256619,http://www.plvc.ac.th
299,1365016202,วิทยาลัยพณิชยการบึงพระพิษณุโลก,พิษณุโลก,ภาคเหนือ,วิทยาลัยพณิชยการ,410,1,,บึงพระ-พิษณุโลก,บึงพระ,เมืองพิษณุโลก,พิษณุโลก,65000,55337551,16.765725,100.26277,http://www.bpcc.ac.th
300,1365016501,วิทยาลัยสารพัดช่างพิษณุโลก,พิษณุโลก,ภาคเหนือ,วิทยาลัยสารพัดช่าง,99 หมู่ 1,1,,ปราบไตรจักร,บ้านคลอง,เมืองพิษณุโลก,พิษณุโลก,65000,55252034,16.834849,100.252315,http://www.plkpoly.ac.th
301,1365026401,วิทยาลัยการอาชีพนครไทย,พิษณุโลก,ภาคเหนือ,วิทยาลัยการอาชีพ,179,3,,,เนินเพิ่ม,นครไทย,พิษณุโลก,65120,055-363-095,17.10896302,100.8704777,http://www.ntic.ac.th
302,1366016101,วิทยาลัยเทคนิคพิจิตร,พิจิตร,ภาคเหนือ,วิทยาลัยเทคนิค,33,,,พิจิตร-กำแพงเพชร,ในเมือง,เมืองพิจิตร,พิจิตร,66000,056 608 572,16.4483124,100.3228194,http://www.pjtc.ac.th
303,1366016501,วิทยาลัยอาชีวศึกษาพิจิตร,พิจิตร,ภาคเหนือ,วิทยาลัยอาชีวศึกษา,316,,,บุษบา,ในเมือง,เมืองพิจิตร,พิจิตร,66000,56613481,16.4394823,100.3544111,http://www.ppc.ac.th/pijit
304,1366076301,วิทยาลัยเกษตรและเทคโนโลยีพิจิตร,พิจิตร,ภาคเหนือ,วิทยาลัยเกษตรและเทคโนโลยี,94 หมู่ 6,6,,พิจิตร-กำแพงเพชร,สามง่าม,สามง่าม,พิจิตร,66140,56691151,16.5011661,100.2125756,http://www.pccat.ac.th
305,1367016101,วิทยาลัยเทคนิคเพชรบูรณ์,เพชรบูรณ์,ภาคเหนือ,วิทยาลัยเทคนิค,212,,,สระบุรี-หล่มสัก,ในเมือง,เมืองเพชรบูรณ์,เพชรบูรณ์,67000,056-711-455,16.435663,101.154664,http://www.pbntc.ac.th
306,1367016301,วิทยาลัยเกษตรและเทคโนโลยีเพชรบูรณ์,เพชรบูรณ์,ภาคเหนือ,วิทยาลัยเกษตรและเทคโนโลยี,157 ม.5,5,,สระบุรี-หล่มสัก,บุ่งคล้า,หล่มสัก,เพชรบูรณ์,67110,0-56705638,16.632681,101.185595,http://www.pbcat.ac.th
307,1367016501,วิทยาลัยสารพัดช่างเพชรบูรณ์,เพชรบูรณ์,ภาคเหนือ,วิทยาลัยสารพัดช่าง,60,,,ถนนนิกรบำรุง,ในเมือง,เมืองเพชรบูรณ์,เพชรบูรณ์,67000,56720395,16.4208544,101.1563634,http://www.polyphet.ac.th
308,1367026401,วิทยาลัยการอาชีพชนแดน,เพชรบูรณ์,ภาคเหนือ,วิทยาลัยการอาชีพ,115/3,13,,ชมฐีรเวช,ชนแดน,ชนแดน,เพชรบูรณ์,67150,56761552,16.180391,100.899451,http://www.cice.ac.th
309,1367056401,วิทยาลัยการอาชีพวิเชียรบุรี,เพชรบูรณ์,ภาคเหนือ,วิทยาลัยการอาชีพ,100,5,,,สระประดู่,วิเชียรบุรี,เพชรบูรณ์,67130,56753049,15.6231267,101.0648857,http://www.wicec.ac.th
310,1370016101,วิทยาลัยเทคนิคราชบุรี,ราชบุรี,ภาคกลาง,วิทยาลัยเทคนิค,433,,,ศรีสุริยวงศ์,หน้าเมือง,เมืองราชบุรี,ราชบุรี,70000,032-338544,13.53285312,99.80805395,http://www.rtc.ac.th
311,1370016501,วิทยาลัยสารพัดช่างราชบุรี,ราชบุรี,ภาคกลาง,วิทยาลัยสารพัดช่าง,1,,,มนตรีสุริยวงศ์,หน้าเมือง,เมืองราชบุรี,ราชบุรี,70000,032-321903,13.539008,99.825355,http://www.rptc.ac.th
312,1370056101,วิทยาลัยเทคนิคราชบุรี 2,ราชบุรี,ภาคกลาง,วิทยาลัยเทคนิค,12,2,,,คุ้งพยอม,บ้านโป่ง,ราชบุรี,70110,32297119,13.784689,99.841659,http://rtech2.ac.th
313,1370056401,วิทยาลัยการอาชีพบ้านโป่ง,ราชบุรี,ภาคกลาง,วิทยาลัยการอาชีพ,98,3,,,ลาดบัวขาว,บ้านโป่ง,ราชบุรี,70110,032-720351,13.833835,99.828349,http://www.bpg.ac.th
314,1370076101,วิทยาลัยเทคนิคโพธาราม,ราชบุรี,ภาคกลาง,วิทยาลัยเทคนิค,56/1,3,,เพชรเกษม(สายเก่า),บ้านฆ้อง,โพธาราม,ราชบุรี,70120,032-231313,13.6909035,99.8697968,http://www.photharam.ac.th
315,1370076301,วิทยาลัยเกษตรและเทคโนโลยีราชบุรี,ราชบุรี,ภาคกลาง,วิทยาลัยเกษตรและเทคโนโลยี,63/1,7,,,เขาชะงุ้ม,โพธาราม,ราชบุรี,70120,32740039,13.734776,99.7250335,http://www.rbcat.ac.th
316,1370086401,วิทยาลัยการอาชีพปากท่อ,ราชบุรี,ภาคกลาง,วิทยาลัยการอาชีพ,153,14,ทุ่งหลวง 36,หินสี,ทุ่งหลวง,ปากท่อ,ราชบุรี,70140,32240865,13.3842496,99.6784414,http://www.ptcc.ac.th
317,1371016101,วิทยาลัยเทคนิคกาญจนบุรี,กาญจนบุรี,ภาคกลาง,วิทยาลัยเทคนิค,361,1,ไม่มี,อู่ทอง,ปากแพรก,เมืองกาญจนบุรี,กาญจนบุรี,71000,34511176,14.02874453,99.54837427,http://www.technickan.ac.th
318,1371016201,วิทยาลัยอาชีวศึกษากาญจนบุรี,กาญจนบุรี,ภาคกลาง,วิทยาลัยอาชีวศึกษา,7,,,แสงชูโต,บ้านเหนือ,เมืองกาญจนบุรี,กาญจนบุรี,71000,34511124,14.026317,99.530964,http://www.kanvc.ac.th
319,1371016301,วิทยาลัยเกษตรและเทคโนโลยีกาญจนบุรี,กาญจนบุรี,ภาคกลาง,วิทยาลัยเกษตรและเทคโนโลยี,1,5,,ลิ้นช้าง-บ้านเก่า,หนองหญ้า,เมืองกาญจนบุรี,กาญจนบุรี,71000,034 552 106 - 7,13.9908858,99.4640893,http://www.kasetkan.ac.th
320,1371016501,วิทยาลัยการอาชีพแม่น้ำแคว,กาญจนบุรี,ภาคกลาง,วิทยาลัยการอาชีพ,179,1,,แสงชูโต,ท่ามะขาม,เมืองกาญจนบุรี,กาญจนบุรี,71000,064 856 2239,14.053279,99.503542,https://www.maenamkwai.ac.th/kan/
321,1371066401,วิทยาลัยการอาชีพกาญจนบุรี,กาญจนบุรี,ภาคกลาง,วิทยาลัยการอาชีพ,296,2,,แสงชูโต,วังขนาย,ท่าม่วง,กาญจนบุรี,71110,034-611792,13.95193381,99.65262552,http://www.kicec.ac.th
322,1371076401,วิทยาลัยการอาชีพทองผาภูมิ,กาญจนบุรี,ภาคกลาง,วิทยาลัยการอาชีพ,,3,,,ท่าขนุน,ทองผาภูมิ,กาญจนบุรี,71000,0-3451-1176,14.680533,98.672282,http://www.technickan.ac.th
